publish_date,headline_category,headline_text
20201022,sports.wwe,win over cena satisfying but defeating undertaker bigger roman reigns
20201023,unknown,Status quo will not be disturbed at Ayodhya; says Vajpayee
20201023,unknown,Fissures in Hurriyat over Pak visit
20201023,unknown,America's unwanted heading for India?
20201023,unknown,For bigwigs; it is destination Goa
20201023,unknown,Extra buses to clear tourist traffic
20201023,unknown,Dilute the power of transfers; says Riberio
20201023,unknown,Focus shifts to teaching of Hindi
20201023,unknown,IT will become compulsory in schools
20201023,unknown,Move to stop freedom fighters' pension flayed
20201023,unknown,Gilani claims he applied for passport 2 years ago
20201023,unknown,Parivar dismisses PM's warning
20201023,unknown,India; Pak exchange lists of N-plants
20201023,unknown,Will Qureshi's return really help the govt?
20201023,unknown,PM's tacit message: Put Ram tample on hold
20201023,unknown,Text of the Prime Minister's article
20201023,unknown,NCW to focus on violence against women
20201023,unknown,BBC's reality TV will focus on AIIMS
20201023,unknown,Jaitley firm on legal reforms
20201023,unknown,Hoshangabad farmers have enough water
20201023,unknown,BJP jumps into rail track conversion issue
20201023,unknown,America's unwanted heading for India?
20201023,unknown,State may take AP to court over Krishna
20201023,unknown,This official has sued the briber
20201023,unknown,Park turns temple compound as residents watch
20201023,unknown,Moves afoot to evict squatters in Urban dist
20201023,unknown,Mafia calls the shots in Gandhinagar too
20201023,unknown,Status quo will not be disturbed at Ayodhya; says Vajpayee
20201023,unknown,Fissures in Hurriyat over Pak visit
20201023,unknown,America's unwanted heading for India?
20201023,unknown,For bigwigs; it is destination Goa
20201023,unknown,Extra buses to clear tourist traffic
20201023,unknown,Dilute the power of transfers; says Riberio
20201023,unknown,Focus shifts to teaching of Hindi
20201023,unknown,IT will become compulsory in schools
20201023,unknown,Move to stop freedom fighters' pension flayed
20201023,unknown,Gilani claims he applied for passport 2 years ago
20201023,unknown,Parivar dismisses PM's warning
20201023,unknown,India; Pak exchange lists of N-plants
20201023,unknown,Will Qureshi's return really help the govt?
20201023,unknown,PM's tacit message: Put Ram tample on hold
20201023,unknown,Text of the Prime Minister's article
20201023,unknown,NCW to focus on violence against women
20201023,unknown,BBC's reality TV will focus on AIIMS
20201023,unknown,Jaitley firm on legal reforms
20201023,unknown,Hoshangabad farmers have enough water
20201023,unknown,BJP jumps into rail track conversion issue
20201023,unknown,America's unwanted heading for India?
20201023,unknown,State may take AP to court over Krishna
20201023,unknown,This official has sued the briber
20201023,unknown,Park turns temple compound as residents watch
20201023,unknown,Moves afoot to evict squatters in Urban dist
20201023,unknown,Mafia calls the shots in Gandhinagar too
20201023,unknown,Come to Nandi Hills...and you can fly
20201023,unknown,HAL approached for super jumbo project
20201023,unknown,Nagathihalli returns with Preethiya Hudugi
20201023,unknown,Fashion in the future
20201023,unknown,Promises to keep
20201023,unknown,Home is where the holistic science is
20201023,unknown,A noisy effort to spruce up Commercial Street
20201023,unknown,The best music of the year
20201023,unknown,Redemption night; amid some rock
20201023,unknown,Consul is back from month-long leave
20201023,unknown,Bomb hoax triggers panic in Canara Bank
20201023,unknown,Petition over ministers' assets dismissed
20201023,unknown,He beat polio; but a truck driver's is no life
20201023,unknown,Destroying myths and doubts on sexuality
20201023,unknown,Planning Dept seeks Rs 350 crore more
20201023,unknown,More engg colleges if needed in state: Govt
20201023,unknown,Auto driver's murder: 4 held
20201023,unknown,Meet held on cashew crop forecasting
20201023,unknown,Awareness rally on AIDS today
20201023,unknown,Record power generation at RTPS
20201023,unknown,Move to stop freedom fighters' pension flayed
20201023,unknown,Snags delay digital maps of city
20201023,unknown,Making education a people's movement
20201023,unknown,Murder spoils 2001 party in Dharwad
20201023,unknown,Now a website on a seer
20201023,unknown,Akki-Alur and Ranebennur peaceful
20201023,unknown,Weekly editor resorts to hunger strike
20201023,unknown,Bickering cost Dal(S) seats; admits Gowda
20201023,unknown,BJP to block traffic statewide on Jan 6
20201023,unknown,Dr Patwardhan to be felicitated
20201023,unknown,Lingambudhi will be turned into bird sanctuary
20201023,unknown,Cactus which made it to Guinness is dying
20201023,unknown,VIPs suffer as power supply is stopped to govt guest houses
20201023,entertainment.hindi.bollywood,Raju Chacha
20201026,unknown,Powerless north India gropes in the dark
20201026,unknown,Think again; Laxman tells Sangh Parivar
20201026,unknown,Hurriyat undecided over team to Pakistan
20201026,unknown,Vajpayee wants to put reforms on fast track
20201026,unknown,Stephen Hawking keeps date with Mumbai
20201026,unknown,Anti-Hrithik or anti-hopelessness
20201026,unknown,Govt plans stadium near Panaji
20201026,unknown,BJP doing a volte face on casinos: Cong
20201026,unknown,3 watershed projects on the anvil
20201026,unknown,No report yet on fire in Udyog Bhavan
20201026,unknown,He is the king of 'five star' industry
20201026,unknown,Petrol pump sealed for selling adulterated fuel
20201026,unknown,Milk price up by Rs 1 per litre
20201026,unknown,Congress House is no-smoking zone
20201026,unknown,Rural weightage: Govt reassures Governor
20201026,unknown,Bride gets honeymoon surprise: Chopper ride
20201026,unknown,Is hangover a sign of alcoholicism?
20201026,unknown,Almatti: AP to wait and watch
20201026,unknown,10-year-old girl missing
20201026,unknown,Hear his messages from the heart
20201026,unknown,Dance like no one's watching
20201026,unknown,From reel love to real love
20201026,unknown,Power row: Bribe attempt charge denied
20201026,unknown,Lakshamma's cry for help heard
20201026,unknown,It's shopping time for your newborn
20201026,unknown,Con games on the catwalk
20201026,unknown,They are here to help us
20201026,unknown,These noisy spots are hurting your ears
20201026,unknown,Flat tyres; flat music and a few famous faces
20201026,unknown,Yogananda birth anniversary fete on Dec 5
20201026,unknown,Tumkur gets 243 borewells
20201026,unknown,Over 2000 workers hit by lockout
20201026,unknown,Child project officer held for fraud
20201026,unknown,BCC holds talks on budget
20201026,unknown,Skybus metro trains on agenda
20201026,unknown,A disciple awaits a miracle from his Goddess
20201026,unknown,TOI scribe among Press Academy awardees
20201026,unknown,Talent Search exams on April 29
20201026,unknown,Ban orders extended in Ranebennur
20201026,unknown,Army turns to HAL for Lancer supply
20201026,entertainment.hindi.bollywood,'Devdas': Jinxed?
20201027,unknown,The string that pulled Stephen Hawking to India
20201027,unknown,Vajpayee gives big push to tech education; R&D
20201027,unknown,Norms for private role in banking tightened
20201027,unknown,A Maha Kumbh of media players
20201027,unknown,Net lottery: A winner or a sucker?
20201027,unknown,Us and the PM's Musings
20201027,unknown,Milosevic to be charged with 'abuse of office'
20201027,unknown,Tabu: Bar Bar Dekho
20201027,unknown,Anupam Kher: Sliver Spoon!
20201027,unknown,Aftab Shivdasani: Career Cares!
20201027,unknown,Court reserves judgment on custody of Ilyasi's daughter
20201027,unknown,A museum far from the madding crowds
20201027,unknown,Bangla Oppn leader issues 'fatwa' against judges
20201027,unknown,Hawking set to inspire science glitterati
20201027,unknown,Mission for technology education; more funds for R&D
20201027,unknown,Mental illness can pass from parent to child
20201027,unknown,Cholera outbreak source traced
20201027,unknown,Mathematics permeates human civilisation
20201027,unknown,Bangla Oppn leader issues 'fatwa' against judges
20201027,unknown,Bangladesh govt asks for Hamoodur Rahman report
20201027,unknown,Bangladesh 'scrutinising' citizen's death in US embassy
20201027,unknown,Claire Danes inks to star in 'It's About Love'
20201027,unknown,Hollywood posts record 9th year of box office gains
20201027,unknown,Akashdeep: Ghaath Ka Saath!
20201027,unknown,Great loss to Indian racing
20201027,unknown,The saga of Usha Stud Farm
20201027,unknown,Red Radior wins Victory Zone Cup
20201027,unknown,Race put off
20201027,unknown,Cyril sends Byron Black packing
20201027,unknown,Dent has the fastest serve in Chennai meet
20201027,unknown,Basu gives call to stop infighting
20201027,unknown,Violence mar Mamata's meeting in Midnapore
20201027,unknown,The string that pulled Stephen Hawking to India
20201027,unknown,Norms for private role in banking tightened
20201027,unknown,Net lottery: A winner or a sucker?
20201027,unknown,Us and the PM's Musings
20201027,unknown,Milosevic to be charged with 'abuse of office'
20201027,unknown,Tabu: Bar Bar Dekho
20201027,unknown,Anupam Kher: Sliver Spoon!
20201027,unknown,Court reserves judgment on custody of Ilyasi's daughter
20201027,unknown,A museum far from the madding crowds
20201027,unknown,Bangla Oppn leader issues 'fatwa' against judges
20201027,unknown,Court reserves judgment on custody of Ilyasi's daughter
20201027,unknown,String theory set to become one of hottest pieces of physics
20201027,unknown,Hawking set to inspire science glitterati
20201027,unknown,Mission for technology education; more funds for R&D
20201027,unknown,Mission for technology education; more funds for R&D
20201027,unknown,Mental illness can pass from parent to child
20201027,unknown,Cholera outbreak source traced
20201027,unknown,Mathematics permeates human civilisation
20201027,unknown,The string that pulled Stephen Hawking to India
20201027,unknown,Vajpayee gives big push to tech education; R&D
20201027,unknown,Norms for private role in banking tightened
20201027,unknown,A Maha Kumbh of media players
20201027,unknown,Net lottery: A winner or a sucker?
20201027,unknown,Us and the PM's Musings
20201027,unknown,Milosevic to be charged with 'abuse of office'
20201027,unknown,Tabu: Bar Bar Dekho
20201027,unknown,Anupam Kher: Sliver Spoon!
20201027,unknown,Aftab Shivdasani: Career Cares!
20201027,unknown,Court reserves judgment on custody of Ilyasi's daughter
20201027,unknown,A museum far from the madding crowds
20201027,unknown,Four more Iranians admit to role in serial murders
20201027,unknown,Bangla Oppn leader issues 'fatwa' against judges
20201027,unknown,String theory set to become one of hottest pieces of physics
20201027,unknown,Hawking set to inspire science glitterati
20201027,unknown,Mission for technology education; more funds for R&D
20201027,unknown,Mental illness can pass from parent to child
20201027,unknown,Cholera outbreak source traced
20201027,unknown,Mathematics permeates human civilisation
20201027,unknown,Bangla Oppn leader issues 'fatwa' against judges
20201027,unknown,Bangladesh govt asks for Hamoodur Rahman report
20201027,unknown,Bangladesh 'scrutinising' citizen's death in US embassy
20201027,unknown,Hollywood posts record 9th year of box office gains
20201027,unknown,Great loss to Indian racing
20201027,unknown,The saga of Usha Stud Farm
20201027,unknown,Red Radior wins Victory Zone Cup
20201027,unknown,Race put off
20201027,unknown,Basu gives call to stop infighting
20201027,unknown,Violence mar Mamata's meeting in Midnapore
20201027,unknown,CPT to have new pilot system by Jan 15
20201027,unknown,Film industry concerned about piracy
20201027,unknown,City drainage system being modernised
20201027,unknown,Keeping the Gandhian dream alive
20201027,unknown,An archaeologist par excellence
20201027,unknown,Education body overshoots self-imposed deadline
20201027,unknown,PIL urges to seek flood relief from UN
20201027,unknown,Sen urges country to exploit its tourism potential
20201027,unknown,CMC to issue notice to builder
20201027,unknown,World govt touted as solution to crises
20201027,unknown,ASI team digs up part of Fatehpur Sikri
20201027,unknown,Lara joins elite club
20201027,unknown,Cullinan hits fourth Newlands hundred
20201027,unknown,Cronje case behind low cricket match attendance
20201027,unknown,Indian refusal cost PCB 2.4 cr
20201027,unknown,Das ready to face the short-pitch stuff
20201027,unknown,Haldipur; Lahiri in good stand
20201027,unknown,DU North Zone inter-varsity cricket champions
20201027,unknown,Kolkata gears up for Millennium Cup
20201027,unknown,Right choice is the key; says Iranian coach
20201027,unknown,Rajasthan lose lead and match
20201027,unknown,Hockey hopes rest on flowerin talent
20201027,unknown,Anand may get Padmabhushan
20201027,unknown,Emotion-choked Chennai showers love on Anand
20201027,unknown,Close battle for Mahindra Golfer; 2001
20201027,unknown,Indian Blues off to a good start
20201027,unknown,Ramgarh beat Royal Kashmir in Hanut Cup polo
20201027,unknown,Anand may get Padmabhushan
20201027,unknown,Cullinan hits fourth Newlands hundred
20201027,unknown,Ex-mayor takes up cudgels against Kothrud garbage depot
20201027,unknown,India is no IT superpower
20201027,unknown,A clean sweep
20201027,unknown,The Sphinx can act too
20201027,unknown,Giving audio-video education a cutting edge
20201027,unknown,Govt orders study of river diversion
20201027,unknown,Govt bears burden as VIPs throng Goa
20201027,unknown,Goa told to start quick-growth coconut project
20201027,unknown,Experts discuss horticulture development
20201027,unknown,5 acquitted in trespassing case
20201027,unknown,Development of horticulture stressed
20201027,unknown,New office-bearers for ICSI
20201027,unknown,CM to review security for Premji; Murthy
20201027,unknown,Govt allots UKP project to KPC
20201027,unknown,Star hotels in city get tech-savvy
20201027,unknown,When principals wed
20201027,unknown,Misbehaving conductors face action
20201027,unknown,Pubs are on the watch for violence
20201027,unknown,Celestial show awaits aircraft lovers
20201027,unknown,Kannada organisations oppose felicitating Nedumaran
20201027,unknown,Civic polls: Minister refutes BJP charges
20201027,unknown,Oh; for that black & white magic!
20201027,unknown,No clue about kidnapped boy
20201027,unknown,New year hash: They paid Rs 18;000; went hungry
20201027,unknown,5;000 anganwadis to get buildings
20201027,unknown,Cops shoot at sandalwood smugglers; nab one
20201027,unknown,Tribute-paying ritual for Patel today
20201027,unknown,A life snuffed out needlessly
20201027,unknown,PM arriving on a 2-day visit
20201027,unknown,Make mysterious kidnap drama secret public
20201027,unknown,Pollution makes these residents see red
20201027,unknown,Behind the walls; it's celebration time
20201027,unknown,Corporate cricket has lot of scope
20201027,unknown,An art gallery for the underprivileged
20201027,unknown,Annual Infant Jesus feast from Jan 14
20201027,unknown,Ex-Karnataka HC judge visits Bahrain
20201027,india,Dudhwa tiger died of starvation; not poisoning
20201027,city.bengaluru,Three in race for chief secy's post
20201027,city.patna,Druggists' stir leads to shortage of medicines
20201027,business.india-business,Car dealers caught in Bihar sales tax ruling
20201027,entertainment.english.hollywood,Space Cowboys
20201027,city.bengaluru,He's not so inscrutable
20201027,city.delhi,DPCC stages Nyay rally
20201027,entertainment.english.hollywood,Unbreakable
20201028,unknown,Light combat craft takes India into club class
20201028,unknown,Hawkings' day out
20201028,unknown,Light combat craft takes India into club class
20201028,unknown,Easy drugs at raves keep Goa hot on tourist circuit
20201028,unknown,CM defends grant to Chaturang
20201028,unknown,Faleiro vows to fight common cadre proposal
20201028,unknown,Sawant questions casino licences
20201028,unknown,MPT posts good show in 2000
20201028,unknown,Ex-GPCC chief against separate cadre
20201028,unknown,Meeting to review anti-defection law
20201028,unknown,Telecom team win play contest
20201028,unknown,Guala Closures bags ISO 9002 certificate
20201028,unknown,Bush names Lindsey top economic aide
20201028,unknown,Bush names Lindsey top economic aide
20201028,unknown,Indian American boy confesses to parents' murder
20201028,unknown,Anti-immigration think-tank berates Clinton regime
20201028,unknown,Sikh teacher guilty of assaulting student
20201028,unknown,Australia; New Zealand urged to accept Indo-Fijian refugees
20201028,unknown,If Rabuka can go free; why not us: Speight partner
20201028,unknown,Tailor Sam's famous clientele
20201028,unknown,Malaysian medics testify about demonstrators' injuries
20201028,unknown,Philippine soldiers arrest bombing suspects
20201028,unknown,Chinese stranded in Dhaka repatriated
20201028,unknown,It's long haul yet for the LCA
20201028,unknown,Captain Courageous says dream has come true
20201028,unknown,LCA to be good enough for next 45 yrs
20201028,unknown,LCA to be top in avionics; strike capability
20201028,unknown,Light combat craft takes India into club class
20201028,unknown,Hawkings' day out
20201028,unknown,Easy drugs at raves keep Goa hot on tourist circuit
20201028,unknown,CM defends grant to Chaturang
20201028,unknown,Faleiro vows to fight common cadre proposal
20201028,unknown,Sawant questions casino licences
20201028,unknown,MPT posts good show in 2000
20201028,unknown,Ex-GPCC chief against separate cadre
20201028,unknown,Meeting to review anti-defection law
20201028,unknown,Telecom team win play contest
20201028,unknown,Guala Closures bags ISO 9002 certificate
20201028,unknown,Bush names Lindsey top economic aide
20201028,unknown,Bush names Lindsey top economic aide
20201028,unknown,Indian American boy confesses to parents' murder
20201028,unknown,Indian American boy confesses to parents' murder
20201028,unknown,Anti-immigration think-tank berates Clinton regime
20201028,unknown,Sikh teacher guilty of assaulting student
20201028,unknown,Australia; New Zealand urged to accept Indo-Fijian refugees
20201028,unknown,If Rabuka can go free; why not us: Speight partner
20201028,unknown,Tailor Sam's famous clientele
20201028,unknown,Malaysian medics testify about demonstrators' injuries
20201028,unknown,Philippine soldiers arrest bombing suspects
20201028,unknown,Chinese stranded in Dhaka repatriated
20201028,unknown,Light combat craft takes India into club class
20201028,unknown,It's long haul yet for the LCA
20201028,unknown,Captain Courageous says dream has come true
20201028,unknown,LCA to be good enough for next 45 yrs
20201028,unknown,LCA to be top in avionics; strike capability
20201028,unknown,CM asks KPTC to keep power tariff hike in abeyance
20201028,unknown,Gowda and Hegde share dais; but fail to talk
20201028,unknown,This cactus is all set to break records
20201028,unknown,Function can't be stopped: Kharge
20201028,unknown,Think twice before you make a wish
20201028,unknown,LCA: Best weapon system for close combat
20201028,unknown,LCA test flight puts India in exclusive club
20201028,unknown,A dream-come-true for LCA pilot
20201028,unknown,Avionics provides multi-role capability to LCA
20201028,unknown,Hoax bomb call sends family into a tizzy
20201028,unknown,Govt order on dismantling Hampi bridge stayed
20201028,unknown,Principals of PU colleges to meet on Jan. 7
20201028,unknown,CM meets Sonia at airport
20201028,unknown,Tributes paid to Patel
20201028,unknown,I am a great fan of Sridevi: Prema
20201028,unknown,This chef knows his yin from yang
20201028,unknown,Wait; wait... for the bus that never comes
20201028,unknown,Taal se taal mila
20201028,unknown,Light combat craft takes India into club class
20201028,unknown,Hawkings' day out
20201028,unknown,Easy drugs at raves keep Goa hot on tourist circuit
20201028,unknown,CM defends grant to Chaturang
20201028,unknown,Sawant questions casino licences
20201028,unknown,MPT posts good show in 2000
20201028,unknown,Ex-GPCC chief against separate cadre
20201028,unknown,Meeting to review anti-defection law
20201028,unknown,Guala Closures bags ISO 9002 certificate
20201028,unknown,Bush names Lindsey top economic aide
20201028,unknown,Bush names Lindsey top economic aide
20201028,unknown,Indian American boy confesses to parents' murder
20201028,unknown,Anti-immigration think-tank berates Clinton regime
20201028,unknown,Sikh teacher guilty of assaulting student
20201028,unknown,Australia; New Zealand urged to accept Indo-Fijian refugees
20201028,unknown,If Rabuka can go free; why not us: Speight partner
20201028,unknown,Tailor Sam's famous clientele
20201028,unknown,Malaysian medics testify about demonstrators' injuries
20201028,unknown,Philippine soldiers arrest bombing suspects
20201028,unknown,Chinese stranded in Dhaka repatriated
20201028,unknown,Light combat craft takes India into club class
20201028,unknown,It's long haul yet for the LCA
20201028,unknown,Captain Courageous says dream has come true
20201028,unknown,LCA to be good enough for next 45 yrs
20201028,unknown,LCA to be top in avionics; strike capability
20201028,unknown,CM asks KPTC to keep power tariff hike in abeyance
20201028,unknown,Gowda and Hegde share dais; but fail to talk
20201028,unknown,This cactus is all set to break records
20201028,unknown,Function can't be stopped: Kharge
20201028,unknown,Think twice before you make a wish
20201028,unknown,LCA: Best weapon system for close combat
20201028,unknown,LCA will be aircraft for next 45 years
20201028,unknown,LCA test flight puts India in exclusive club
20201028,unknown,A dream-come-true for LCA pilot
20201028,unknown,Avionics provides multi-role capability to LCA
20201028,unknown,Hoax bomb call sends family into a tizzy
20201028,unknown,Govt order on dismantling Hampi bridge stayed
20201028,unknown,Principals of PU colleges to meet on Jan. 7
20201028,unknown,CM meets Sonia at airport
20201028,unknown,Tributes paid to Patel
20201028,unknown,I am a great fan of Sridevi: Prema
20201028,unknown,This chef knows his yin from yang
20201028,unknown,Wait; wait... for the bus that never comes
20201028,unknown,Taal se taal mila
20201028,unknown,Mahalakshmi Layout: Crumbling past; rapid growth
20201028,unknown,'We're waiting for people with money'
20201028,unknown,An actress and many other things besides
20201028,unknown,Mobile isn't a phone but a fun machine now
20201028,unknown,Time to bow out for 14 top bureaucrats
20201028,unknown,Silk is sexy this year
20201028,unknown,Seeds firm condemns hooliganism
20201028,edit-page,Nepal won't allow anti-India activities: Envoy
20201028,india,MP best in forest development: Centre
20201029,unknown,Light combat craft takes India into club class
20201029,unknown,Hawkings' day out
20201029,unknown,Ex-GPCC chief against separate cadre
20201029,unknown,Meeting to review anti-defection law
20201029,unknown,Telecom team win play contest
20201029,unknown,Guala Closures bags ISO 9002 certificate
20201029,unknown,Bush names Lindsey top economic aide
20201029,unknown,Bush names Lindsey top economic aide
20201029,unknown,Indian American boy confesses to parents' murder
20201029,unknown,Anti-immigration think-tank berates Clinton regime
20201029,unknown,Sikh teacher guilty of assaulting student
20201029,unknown,Australia; New Zealand urged to accept Indo-Fijian refugees
20201030,unknown,Muslim body rules out talks on Ayodhya
20201030,unknown,Bajrang Dal blows hot; cold
20201030,unknown,Vajpayee rejects Nitish's resignation
20201030,unknown,PM taps diaspora to realise Indian ambition
20201030,unknown,India cagey about food imports
20201030,unknown,US leggy chicks to come in hordes
20201030,unknown,Microsoft; Intel line up top-end products for electronics show
20201030,unknown,Khosla among Upside's 25 people to watch in 2001
20201030,unknown,Spending on Net projects may be hit
20201030,unknown,British doctor may be worst mass murderer in modern history
20201030,unknown,British judge reveals threats from racists
20201030,unknown,Clinton urges US Congress to ratify CTBT
20201030,unknown,Blind climber to scale Mt. Everest
20201030,unknown,Does American TV have a realism overdose?
20201030,unknown,Banking community must chalk out new system: Jalan
20201030,unknown,Delhi to host India-EU working group meeting on IT
20201030,unknown,PNB raises rates
20201030,unknown,Are green activists the new imperialists
20201030,unknown,Muslim body rules out talks on Ayodhya
20201030,unknown,Bajrang Dal blows hot; cold
20201030,unknown,Vajpayee rejects Nitish's resignation
20201030,unknown,PM taps diaspora to realise Indian ambition
20201030,unknown,India cagey about food imports
20201030,unknown,US leggy chicks to come in hordes
20201030,unknown,Microsoft; Intel line up top-end products for electronics show
20201030,unknown,Khosla among Upside's 25 people to watch in 2001
20201030,unknown,Spending on Net projects may be hit
20201030,unknown,British doctor may be worst mass murderer in modern history
20201030,unknown,British judge reveals threats from racists
20201030,unknown,Clinton urges US Congress to ratify CTBT
20201030,unknown,Blind climber to scale Mt. Everest
20201030,unknown,Does American TV have a realism overdose?
20201030,unknown,Banking community must chalk out new system: Jalan
20201030,unknown,Delhi to host India-EU working group meeting on IT
