publish_date,headline_category,headline_text
20201030,unknown,Are green activists the new imperialists
20201030,unknown,Asian auto firms bullish on US market
20201030,unknown,Clinton urges US Congress to ratify CTBT
20201030,unknown,US gets its first multicultural cabinet
20201030,unknown,Indian American couple sentenced for injuries to child
20201030,unknown,Mumbai firm to be sentenced in US
20201030,unknown,Parsi men have failed their women
20201030,unknown,Does American TV have a realism overdose?
20201030,unknown,Transit; port use to top talks during Nepal minister's visit
20201030,unknown,Kuldip Sharma's exit will lead to sea change in policing
20201030,unknown,WREB warns SEBs of north-like tripping
20201030,unknown,Chaotic traffic in Mehsana: Authorities have washed hands
20201030,unknown,MSU gears up for NAAC visit; expects a five-star rating
20201030,unknown,Residents here have invested in bore-wells
20201030,unknown,Need for farmers to become professionals: Expert
20201030,unknown,Aamir Khan: 'Lagaan' ko zabaan do
20201030,unknown,Rajkumar Santoshi: Khan pe khan
20201030,unknown,Kamal Haasan: Hey (Thenali) Ram
20201030,unknown,Darshans show Bollywood a way out of financial woes
20201030,unknown,Latest Hrithik movie could make Canberra a hit
20201030,unknown,The Bali beat goes beyond bhangra
20201030,unknown,Tops to trousers; they're going for gold!
20201030,unknown,Aamir Khan: 'Lagaan' ko zabaan do
20201030,unknown,Rajkumar Santoshi: Khan pe khan
20201030,unknown,Kamal Haasan: Hey (Thenali) Ram
20201030,unknown,Darshans show Bollywood a way out of financial woes
20201030,unknown,German TV admits millionaire show was a sham
20201030,unknown,Parliament suggests resignation of TV official
20201030,unknown,Traffic lights
20201030,unknown,Just one of those faces
20201030,unknown,Steve Waugh looks forward to Indian summer
20201030,unknown,Strong comeback by Shane Warne
20201030,unknown,Cricket board chief means business
20201102,unknown,Sangh Parivar; Babri panel up the ante
20201102,unknown,Frontrunner for key US post seen having Pak tilt
20201102,unknown,Muslims see red over Coke logo
20201102,unknown,Move over Nepal; Casino Goa is here
20201102,unknown,Merit Calling
20201102,unknown,Closures putting financial strain on Delhi Govt
20201102,unknown,42 units to be sealed in phase-II of operation closure
20201102,unknown,Special trains for Kumbh Mela
20201102,unknown,CPM for survey of units
20201102,unknown,NIEPA meet to discuss issue of re-employing retired teachers
20201102,unknown,Such a long journey to the green dispenser
20201102,unknown,Woman fighting for life as 'quack' performed MTP
20201102,unknown,Cold weather puts strain on people with weak hearts
